Nombre de délibération,COLL_NOM,COLL_SIRET,DELIB_ID,DELIB_DATE,DELIB_MATIERE_CODE,DELIB_MATIERE_NOM,DELIB_OBJET,BUDGET_ANNEE,BUDGET_NOM,PREF_ID,PREF_DATE,VOTE_EFFECTIF,VOTE_REEL,VOTE_POUR,VOTE_CONTRE,VOTE_ABSTENTION,DELIB_URL
1,Saint-etienne metropole (SEM),24420077000117,2022.00028,2022-03-24,,COMMANDE PUBLIQUE,"PLAN DE RELANCE METROPOLITAIN 2021-2023 - ATTRIBUTION D’UN FONDS
DE CONCOURS A LA COMMUNE DE LA TOUR-EN-JAREZ - CONSTRUCTION
D’UN ESPACE INTERGENERATIONNEL",2022,"Administration Générale du
Budget Principal",PREF042,2022-04-04,123,89,101,0,4,https://www.saint-etienne-metropole.fr/la-metropole/vie-democratique/deliberations
2,Saint-etienne metropole (SEM),24420077000117,2022.00033,2022-03-24,,COMMANDE PUBLIQUE,"DELEGATION DE SERVICE PUBLIC TRANSPORT URBAIN DE VOYAGEURS ET
DES SERVICES DE MOBILITES - CHOIX DU DELEGATAIRE - APPROBATION",2022,"annexe
des transports",PREF042,2022-04-04,123,95,98,5,4,https://www.saint-etienne-metropole.fr/la-metropole/vie-democratique/deliberations
3,Saint-etienne metropole (SEM),24420077000117,2022.00034,2022-03-24,,COMMANDE PUBLIQUE,"PLAN DE RELANCE METROPOLITAIN 2021-2023 - ATTRIBUTION D’UN FONDS
DE CONCOURS A LA COMMUNE DE FONTANES - AMENAGEMENT DE LA
ZONE DE LOISIRS DU RIO",2022,"Administration
Générale du Budget Principal",PREF042,2022-04-04,123,89,101,0,4,https://www.saint-etienne-metropole.fr/la-metropole/vie-democratique/deliberations
4,Saint-etienne metropole (SEM),24420077000117,2022.00047,2022-03-24,,COMMANDE PUBLIQUE,"VŒU RELATIF A LA SCOLARISATION DES ENFANTS DEFICIENTS VISUELS
DANS LA LOIRE",2022,,PREF042,2022-04-04,123,88,104,0,0,https://www.saint-etienne-metropole.fr/la-metropole/vie-democratique/deliberations
5,Saint-etienne metropole (SEM),24420077000117,2022.00048,2022-03-24,,COMMANDE PUBLIQUE,"TRAVAUX DE DISSIMULATION DES RESEAUX SECS, RUE DU BREUIL SUR LA
COMMUNE DE VILLARS - ATTRIBUTION D’UN FONDS DE CONCOURS AU SIEL",2022,Voirie,PREF042,2022-04-04,123,88,104,0,0,https://www.saint-etienne-metropole.fr/la-metropole/vie-democratique/deliberations
6,Saint-etienne metropole (SEM),24420077000117,2022.00053,2022-03-24,,COMMANDE PUBLIQUE,"TRAVAUX DE DISSIMULATION DE RESEAUX RUE CLOS MARQUET COMMUNE
DE SAINT-CHAMOND - ATTRIBUTION D’UN FONDS DE CONCOURS AU SIEL",2022,Voirie,PREF042,2022-04-04,123,88,104,0,0,https://www.saint-etienne-metropole.fr/la-metropole/vie-democratique/deliberations
7,Saint-etienne metropole (SEM),24420077000117,2022.00054,2022-03-24,,URBANISME,"PLAN LOCAL D’URBANISME (PLU) DE ROCHE-LA-MOLIERE - APPROBATION
DE LA MODIFICATION SIMPLIFIEE N°1",2022,"investissement 2022
Prospective, destination Planification",PREF042,2022-04-04,123,88,104,0,0,https://www.saint-etienne-metropole.fr/la-metropole/vie-democratique/deliberations
8,Saint-etienne metropole (SEM),24420077000117,2022.00057,2022-03-24,,INSTITUTIONS et VIE POLITIQUE,"DELEGATION CADRE ACCORDEE AU PRESIDENT POUR LA DECISION DE
RECOURIR A L’EMPRUNT ET AUX OPERATIONS DE COUVERTURE",2022,"Compte
Administratif et Budget Primitif",PREF042,2022-04-04,123,92,107,0,0,https://www.saint-etienne-metropole.fr/la-metropole/vie-democratique/deliberations
9,Saint-etienne metropole (SEM),24420077000117,2022.00103,2022-03-24,,INSTITUTIONS et VIE POLITIQUE,"DESIGNATIONS DES REPRESENTANTS DE SAINT-ETIENNE METROPOLE
DANS DIVERS ORGANISMES",2022,,PREF042,2022-04-04,123,88,104,0,4,https://www.saint-etienne-metropole.fr/la-metropole/vie-democratique/deliberations
10,Saint-etienne metropole (SEM),24420077000117,2022.00103,2022-03-24,,COMMANDE PUBLIQUE,"TRAITEMENT DES ECARTS NEGATIFS SUR LES DEPOTS D’ESPECES DES
REGIES A LA BANQUE POSTALE",2022,,PREF042,2022-04-04,123,92,107,0,0,https://www.saint-etienne-metropole.fr/la-metropole/vie-democratique/deliberations
11,Saint-etienne metropole (SEM),24420077000117,2022.00104,2022-03-24,,COMMANDE PUBLIQUE,Taux de la cotisation foncière des entreprises applicable en 2022,2022,budget principal,PREF042,2022-04-04,123,92,107,0,0,https://www.saint-etienne-metropole.fr/la-metropole/vie-democratique/deliberations
12,Saint-etienne metropole (SEM),24420077000117,2022.00105,2022-03-24,,COMMANDE PUBLIQUE,"TRAVAUX DE DISSIMULATION DE RESEAUX IMPASSE MARC SEGUIN
COMMUNE DE SAINT-CHAMOND - ATTRIBUTION D’UN FONDS DE CONCOURS
AU SIEL",2022,Voirie,PREF042,2022-04-04,123,88,104,0,0,https://www.saint-etienne-metropole.fr/la-metropole/vie-democratique/deliberations
13,Saint-etienne metropole (SEM),24420077000117,2022.00107,2022-03-24,,COMMANDE PUBLIQUE,"Plan d’aménagement du massif forestier de la commune de Firminy, situé autour des barrages des Plats et de l’Echapre, en gestion à Saint-Etienne Métropole",2022,,PREF042,2022-04-04,123,88,104,0,0,https://www.saint-etienne-metropole.fr/la-metropole/vie-democratique/deliberations
14,Saint-etienne metropole (SEM),24420077000117,2022.00107,2022-03-24,,URBANISME,"PLAN LOCAL D’URBANISME (PLU) DE DARGOIRE - MODIFICATION
SIMPLIFIEE N°1 - MODALITES DE MISE A DISPOSITION DU PUBLIC",2022,,PREF042,2022-04-04,123,88,104,0,0,https://www.saint-etienne-metropole.fr/la-metropole/vie-democratique/deliberations
15,Saint-etienne metropole (SEM),24420077000117,2022.00108,2022-03-24,,COMMANDE PUBLIQUE,"AUTORISATIONS DE PROGRAMME - AJUSTEMENTS DANS LE CADRE DU
BUDGET PRIMITIF 2022",2022,transport,PREF042,2022-04-04,123,90,95,0,9,https://www.saint-etienne-metropole.fr/la-metropole/vie-democratique/deliberations
16,Saint-etienne metropole (SEM),24420077000117,2022.00109,2022-03-24,,COMMANDE PUBLIQUE,"SERVICE PUBLIC DE PRODUCTION ET DE DISTRIBUTION D’EAU POTABLE
SUR LE PERIMETRE DESSERVI PAR L’USINE DE SOLAURE - CHOIX DU
DELEGATAIRE",2022,,PREF042,2022-04-04,123,101,98,10,5,https://www.saint-etienne-metropole.fr/la-metropole/vie-democratique/deliberations
17,Saint-etienne metropole (SEM),24420077000117,2022.00112,2022-03-24,,COMMANDE PUBLIQUE,"PROJET TERRITOIRE ZERO CHOMEURS DE LONGUE DUREE - SOUTIEN A LA
CANDIDATURE AU FONDS D’EXPERIMENTATION DE LA VILLE DE SAINTETIENNE SUR LE QUARTIER DE MONTREYNAUD - APPROBATION",2022,,PREF042,2022-04-04,123,88,104,0,0,https://www.saint-etienne-metropole.fr/la-metropole/vie-democratique/deliberations
18,Saint-etienne metropole (SEM),24420077000117,2022.00112,2022-03-24,,COMMANDE PUBLIQUE,Travaux de dissimulation des réseaux secs – Rue Victor Hugo - Commune de Saint-Jean-Bonnefonds - Attribution d’un fonds de concours au SIEL,2022,Voirie,PREF042,2022-04-04,123,88,104,0,0,https://www.saint-etienne-metropole.fr/la-metropole/vie-democratique/deliberations
19,Saint-etienne metropole (SEM),24420077000117,2022.00113,2022-03-24,,COMMANDE PUBLIQUE,Opération de voirie - Versement d’un fonds de concours par la commune de La Valla-en-Gier à Saint-Etienne Métropole – Modification de la délibération 2021.00536 du 02 décembre 2021,2022,Voirie,PREF042,2022-04-04,123,88,104,0,0,https://www.saint-etienne-metropole.fr/la-metropole/vie-democratique/deliberations
20,Saint-etienne metropole (SEM),24420077000117,2022.00114,2022-03-24,,COMMANDE PUBLIQUE,Plan de relance métropolitain 2021-2023 - Attribution d'un fonds de concours à la commune de Farnay - Création de deux logements,2022,"Administration
Générale du Budget Principal",PREF042,2022-04-04,123,89,101,0,4,https://www.saint-etienne-metropole.fr/la-metropole/vie-democratique/deliberations
21,Saint-etienne metropole (SEM),24420077000117,2022.00114,2022-03-24,,COMMANDE PUBLIQUE,Note d'enjeux dans le cadre de la révision du SCoT Sud Loire,2022,,PREF042,2022-04-04,123,88,104,0,0,https://www.saint-etienne-metropole.fr/la-metropole/vie-democratique/deliberations
22,Saint-etienne metropole (SEM),24420077000117,2022.00116,2022-03-24,,COMMANDE PUBLIQUE,Taux des taxes foncières applicables en 2022,2022,budget principal de l’exercice 2022,PREF042,2022-04-04,123,90,97,6,1,https://www.saint-etienne-metropole.fr/la-metropole/vie-democratique/deliberations
23,Saint-etienne metropole (SEM),24420077000117,2022.00118,2022-03-24,,COMMANDE PUBLIQUE,"Travaux d’extension du réseau BTS (basse tension), secteur de l’église sur la commune de L’Etrat - Attribution d’un fonds de concours au SIEL",2022,Voirie,PREF042,2022-04-04,123,88,104,0,0,https://www.saint-etienne-metropole.fr/la-metropole/vie-democratique/deliberations
24,Saint-etienne metropole (SEM),24420077000117,2022.00118,2022-03-24,,COMMANDE PUBLIQUE,Travaux de dissimulation de réseaux impasse Chatelard commune de Saint-Chamond - Attribution d’un fonds de concours au SIEL,2022,Voirie,PREF042,2022-04-04,123,88,104,0,0,https://www.saint-etienne-metropole.fr/la-metropole/vie-democratique/deliberations
25,Saint-etienne metropole (SEM),24420077000117,2022.00118,2022-03-24,,COMMANDE PUBLIQUE,Site Patrimonial Remarquable Saint-Etienne Centre Sud - Nouvel arrêt de projet,2022,,PREF042,2022-03-25,123,88,104,0,4,https://www.saint-etienne-metropole.fr/la-metropole/vie-democratique/deliberations
26,Saint-etienne metropole (SEM),24420077000117,2022.00121,2022-03-24,,COMMANDE PUBLIQUE,Contrat de Délégation de service public pour la construction et l’exploitation du crématorium de Montmartre - Avenant n°1,2022,,PREF042,2022-04-04,123,88,104,0,0,https://www.saint-etienne-metropole.fr/la-metropole/vie-democratique/deliberations
27,Saint-etienne metropole (SEM),24420077000117,2022.00122,2022-03-24,,COMMANDE PUBLIQUE,Tarifs Musée d'art moderne et contemporain - Biennale du design 2022,2022,budget de l’exercice en cours,PREF042,2022-04-04,123,88,104,0,0,https://www.saint-etienne-metropole.fr/la-metropole/vie-democratique/deliberations
28,Saint-etienne metropole (SEM),24420077000117,2022.00122,2022-03-24,,COMMANDE PUBLIQUE,Travaux d’enfouissement de réseaux secs « rue de Cotatay/Pelissière» commune du Chambon-Feugerolles - Attribution d’un fonds de concours au SIEL,2022,Voirie,PREF042,2022-04-04,123,88,104,0,0,https://www.saint-etienne-metropole.fr/la-metropole/vie-democratique/deliberations
29,Saint-etienne metropole (SEM),24420077000117,2022.00122,2022-03-24,,COMMANDE PUBLIQUE,Liste des délibérations prises en application des délégations au Bureau : Bureau du 20 janvier 2022 (conformément à la délibération du Conseil Métropolitain du 17 juillet 2020),2022,,PREF042,2022-04-04,123,88,104,0,0,https://www.saint-etienne-metropole.fr/la-metropole/vie-democratique/deliberations
30,Saint-etienne metropole (SEM),24420077000117,2022.00125,2022-03-24,,COMMANDE PUBLIQUE,Travaux de dissimulation de réseaux rue Loubet commune de Saint-Chamond - Attribution d’un fonds de concours au SIEL,2022,voirie,PREF042,2022-04-04,123,88,104,0,0,https://www.saint-etienne-metropole.fr/la-metropole/vie-democratique/deliberations
31,Saint-etienne metropole (SEM),24420077000117,2022.00127,2022-03-25,,COMMANDE PUBLIQUE,Traitement des écarts négatifs sur les dépôts d'espèces des régies à la Banque Postale,2022,,PREF042,2022-04-05,123,92,107,0,0,https://www.saint-etienne-metropole.fr/la-metropole/vie-democratique/deliberations
32,Saint-etienne metropole (SEM),24420077000117,2022.0013,2022-03-24,,,"Travaux d’extension du réseau BTS (basse tension), secteur de l’église sur la commune de L’Etrat - Attribution d’un fonds de concours au SIEL",2022,Voirie,PREF042,2022-04-04,123,88,104,0,0,https://www.saint-etienne-metropole.fr/la-metropole/vie-democratique/deliberations
33,Saint-etienne metropole (SEM),24420077000117,2022.00131,2022-03-24,,,Travaux de dissimulation de réseaux impasse Chatelard commune de Saint-Chamond - Attribution d’un fonds de concours au SIEL,2022,Voirie,PREF042,2022-04-04,123,88,104,0,0,https://www.saint-etienne-metropole.fr/la-metropole/vie-democratique/deliberations
34,Saint-etienne metropole (SEM),24420077000117,2022.00131,2022-03-24,,,Site Patrimonial Remarquable Saint-Etienne Centre Sud - Nouvel arrêt de projet,2022,,PREF042,2022-03-25,123,88,104,0,0,https://www.saint-etienne-metropole.fr/la-metropole/vie-democratique/deliberations
35,Saint-etienne metropole (SEM),24420077000117,2022.00132,2022-03-24,,,Contrat de Délégation de service public pour la construction et l’exploitation du crématorium de Montmartre - Avenant n°1,2022,amenagement,PREF042,2022-04-04,123,88,104,0,0,https://www.saint-etienne-metropole.fr/la-metropole/vie-democratique/deliberations
36,Saint-etienne metropole (SEM),24420077000117,2022.00133,2022-03-24,,,Tarifs Musée d'art moderne et contemporain - Biennale du design 2022,2022,"budget de l’exercice en cours, à l’article 7062 «redevances à caractère culturel »",PREF042,2022-04-04,123,88,104,0,0,https://www.saint-etienne-metropole.fr/la-metropole/vie-democratique/deliberations
37,Saint-etienne metropole (SEM),24420077000117,2022.00133,2022-03-24,,,Travaux d’enfouissement de réseaux secs « rue de Cotatay/Pelissière» commune du Chambon-Feugerolles - Attribution d’un fonds de concours au SIEL,2022,Voirie,PREF042,2022-04-04,123,88,104,0,0,https://www.saint-etienne-metropole.fr/la-metropole/vie-democratique/deliberations
38,Saint-etienne metropole (SEM),24420077000117,2022.00134,2022-03-24,,,Liste des délibérations prises en application des délégations au Bureau : Bureau du 20 janvier 2022 (conformément à la délibération du Conseil Métropolitain du 17 juillet 2020,2022,,PREF042,2022-04-04,123,88,104,0,0,https://www.saint-etienne-metropole.fr/la-metropole/vie-democratique/deliberations
39,Saint-etienne metropole (SEM),24420077000117,2022.00134,2022-03-24,,,Désignations des représentants de Saint-Etienne Métropole dans divers organismes,2022,Désignation des représentants,PREF042,2022-04-04,123,88,104,0,4,https://www.saint-etienne-metropole.fr/la-metropole/vie-democratique/deliberations
40,Saint-etienne metropole (SEM),24420077000117,2022.00136,2022-03-24,,,Traitement des écarts négatifs sur les dépôts d'espèces des régies à la Banque Postale,2022,Fiscalité,PREF042,2022-04-04,123,92,107,0,0,https://www.saint-etienne-metropole.fr/la-metropole/vie-democratique/deliberations
41,Saint-etienne metropole (SEM),24420077000117,2022.00136,2022-03-24,,,Taux de la cotisation foncière des entreprises applicable en 2022,2022,Décisions budgétaires,PREF042,2022-04-04,123,92,107,0,0,https://www.saint-etienne-metropole.fr/la-metropole/vie-democratique/deliberations
42,Saint-etienne metropole (SEM),24420077000117,2022.00137,2022-03-24,,,Travaux de dissimulation de réseaux impasse Marc Seguin commune de Saint-Chamond - Attribution d’un fonds de concours au SIEL,2022,Voirie,PREF042,2022-04-04,123,88,104,0,0,https://www.saint-etienne-metropole.fr/la-metropole/vie-democratique/deliberations
43,Saint-etienne metropole (SEM),24420077000117,2022.00139,2022-03-24,,,"Plan d’aménagement du massif forestier de la commune de Firminy, situé autour des barrages des Plats et de l’Echapre, en gestion à Saint-Etienne Métropole",2022,amenagement,PREF042,2022-04-04,123,88,104,0,0,https://www.saint-etienne-metropole.fr/la-metropole/vie-democratique/deliberations
44,Saint-etienne metropole (SEM),24420077000117,2022.00139,2022-03-24,,,Plan Local d'Urbanisme (PLU) de Dargoire - Modification simplifiée n°1 - Modalités de mise à disposition du public,2022,urbanisme,PREF042,2022-04-04,123,88,104,0,0,https://www.saint-etienne-metropole.fr/la-metropole/vie-democratique/deliberations
45,Saint-etienne metropole (SEM),24420077000117,2022.0014,2022-03-24,,,Autorisations de programme - Ajustements dans le cadre du budget primitif 2022,2022,,PREF042,2022-04-04,123,90,95,0,9,https://www.saint-etienne-metropole.fr/la-metropole/vie-democratique/deliberations
46,Saint-etienne metropole (SEM),24420077000117,2022.00141,2022-03-24,,,Travaux de dissimulation de réseaux rue Jean Mace commune de Saint-Chamond - Attribution d’un fonds de concours au SIEL,2022,voire,PREF042,2022-04-04,123,88,104,0,0,https://www.saint-etienne-metropole.fr/la-metropole/vie-democratique/deliberations
47,Saint-etienne metropole (SEM),24420077000117,2022.00142,2022-03-24,,,Plan local d'urbanisme (PLU) de la commune de Genilac - Approbation de la modification simplifiée n°2,2022,urbanisme,PREF042,2022-04-04,123,88,104,0,0,https://www.saint-etienne-metropole.fr/la-metropole/vie-democratique/deliberations
48,Saint-etienne metropole (SEM),24420077000117,2022.00142,2022-03-24,,,Soutien au Gérontopôle Auvergne-Rhône-Alpes (AURA) - Avenant n°1 (année 2022) à la convention de financement triennale 2021-2023,2022,subventions,PREF042,2022-04-04,123,88,104,0,0,https://www.saint-etienne-metropole.fr/la-metropole/vie-democratique/deliberations
49,Saint-etienne metropole (SEM),24420077000117,2022.00143,2022-03-24,,,Plan local d'Urbanisme (PLU) de la commune de Saint-Romain-en-Jarez - Approbation de la modification simplifiée n°1,2022,Urbanisme,PREF042,2022-04-04,123,88,104,0,0,https://www.saint-etienne-metropole.fr/la-metropole/vie-democratique/deliberations
50,Saint-etienne metropole (SEM),24420077000117,2022.00144,2022-03-24,,,"Travaux d’extension basse tension, la Guithardière sur la commune de L’Etrat - Attribution d’un fonds de concours au SIEL",2022,Voirie,PREF042,2022-04-04,123,88,104,0,0,https://www.saint-etienne-metropole.fr/la-metropole/vie-democratique/deliberations
51,Saint-etienne metropole (SEM),24420077000117,2022.00147,2022-03-24,,,Programme Local de l'Habitat - Soutien de Saint-Etienne Métropole à la rénovation énergétique des copropriétés,2022,subventions,PREF042,2022-04-04,123,88,100,0,4,https://www.saint-etienne-metropole.fr/la-metropole/vie-democratique/deliberations
52,Saint-etienne metropole (SEM),24420077000117,2022.00148,2022-03-24,,,Liste des délibérations prises en application des délégations au Bureau : Bureau du 10 février 2022 (conformément à la délibération du Conseil Métropolitain du 17 juillet 2020),2022,,PREF042,2022-04-04,123,88,104,0,0,https://www.saint-etienne-metropole.fr/la-metropole/vie-democratique/deliberations
53,Saint-etienne metropole (SEM),24420077000117,2022.00148,2022-01-27,,,"Travaux de dissimulation des reseaux secs, rue du triolet sur la commune de villars - attribution d’un fonds de concours au siel",2022,Voirie,PREF042,2022-04-04,123,92,110,0,0,https://www.saint-etienne-metropole.fr/la-metropole/vie-democratique/deliberations
54,Saint-etienne metropole (SEM),24420077000117,2022.00149,2022-01-27,,,Durée d'amortissement des budgets réseaux de chaleur,2022,Environnement,PREF042,2022-04-04,123,92,110,0,0,https://www.saint-etienne-metropole.fr/la-metropole/vie-democratique/deliberations
55,Saint-etienne metropole (SEM),24420077000117,2022.0015,2022-01-27,,,Travaux de dissimulation de réseaux – Place Neyrand Thiollière - Commune de Lorette - Attribution d'un fonds de concours au SIEL,2022,Voirie,PREF042,2022-04-04,123,92,110,0,0,https://www.saint-etienne-metropole.fr/la-metropole/vie-democratique/deliberations
56,Saint-etienne metropole (SEM),24420077000117,2022.0015,2022-01-27,,,Plan Local d'Urbanisme (PLU) de La Valla-en-Gier - Modification simplifiée n°1- Modalités de mise à disposition du public,2022,Urbanisme,PREF042,2022-04-04,123,92,110,0,0,https://www.saint-etienne-metropole.fr/la-metropole/vie-democratique/deliberations
57,Saint-etienne metropole (SEM),24420077000117,2022.00152,2022-01-27,,,Liste des décisions prises en application des délégations au Président (conformément à la délibération du Conseil Métropolitain du 17 juillet 2020),2022,,PREF042,2022-04-04,123,92,110,0,0,https://www.saint-etienne-metropole.fr/la-metropole/vie-democratique/deliberations
58,Saint-etienne metropole (SEM),24420077000117,2022.00152,2022-01-27,,,Rapport de Saint-Etienne Métropole sur la situation en matière d'égalité femmes hommes pour l'année 2020,2022,,PREF042,2022-04-04,123,93,110,0,0,https://www.saint-etienne-metropole.fr/la-metropole/vie-democratique/deliberations
59,Saint-etienne metropole (SEM),24420077000117,2022.00153,2022-01-27,,,Travaux d'extension de réseau électrique secteur Fayet commune de Saint Christo-en-Jarez - Attribution d'un fonds de concours au Siel,2022,Voirie,PREF042,2022-04-04,123,92,110,0,0,https://www.saint-etienne-metropole.fr/la-metropole/vie-democratique/deliberations
60,Saint-etienne metropole (SEM),24420077000117,2022.00154,2022-01-27,,,"Travaux de dissimulation de réseaux secs"" Allée du Levant"" commune de La Fouillouse - Attribution d'un fonds de concours SIEL",2022,Voirie,PREF042,2022-04-04,123,92,110,0,0,https://www.saint-etienne-metropole.fr/la-metropole/vie-democratique/deliberations
61,Saint-etienne metropole (SEM),24420077000117,2022.00047,2022-01-27,,,"TRAVAUX DE DISSIMULATION DES RESEAUX SECS, RUE DU TRIOLET SUR LA COMMUNE DE VILLARS - ATTRIBUTION D’UN FONDS DE CONCOURS AU SIEL",2022,VOIRIE,PREF042,2022-02-08,123,92,110,0,0,https://www.saint-etienne-metropole.fr/la-metropole/vie-democratique/deliberations
62,Saint-etienne metropole (SEM),24420077000117,2022.00039,2022-01-27,,,PLAN DE RELANCE METROPOLITAIN 2021-2023 - ATTRIBUTION D’UN FONDS DE CONCOURS A LA COMMUNE DE SAINT-HEAND - EXTENSION DU BATIMENT DU JARDIN D’ENFANTS ET DU GROUPE SCOLAIRE BEAUVALLON,2022,ADMINISTRATION GÉNÉRALE DU BUDGET PRINCIPAL,PREF042,2022-02-08,123,93,110,0,0,https://www.saint-etienne-metropole.fr/la-metropole/vie-democratique/deliberations
63,Saint-etienne metropole (SEM),24420077000117,2022.00043,2022-01-27,,,SYNDICAT MIXTE D’AMENAGEMENT DES GORGES DE LA LOIRE - MODIFICATION DES STATUTS,2022,,PREF042,2022-02-08,123,92,110,0,0,https://www.saint-etienne-metropole.fr/la-metropole/vie-democratique/deliberations
64,Saint-etienne metropole (SEM),24420077000117,2022.00029,2022-01-27,,,PLAN LOCAL D’URBANISME (PLU) DE VILLARS - MODIFICATION SIMPLIFIEE N°2- MODALITES DE MISE A DISPOSITION DU PUBLIC,2022,INVESTISEMENT 2022 PROSPECTIVE DESTINATION PLANIFICATION,PREF042,2022-01-28,123,92,110,0,0,https://www.saint-etienne-metropole.fr/la-metropole/vie-democratique/deliberations
65,Saint-etienne metropole (SEM),24420077000117,2022.00056,2022-01-27,,DESIGNATION DES REPRESENTANTS,DESIGNATION DES REPRESENTANTS DE SAINT-ETIENNE METROPOLE AU SEIN DE DIVERS ORGANISMES,2022,,PREF042,2022-02-08,123,92,110,0,0,https://www.saint-etienne-metropole.fr/la-metropole/vie-democratique/deliberations
66,Saint-etienne metropole (SEM),24420077000117,2022.0003,2022-01-27,,,PLAN LOCAL D’URBANISME (PLU) DE PAVEZIN - MODIFICATION SIMPLIFIEE N°1 - MODALITES DE MISE A DISPOSITION DU PUBLIC - ANNULE ET REMPLACE LA DELIBERATION N° 2021.00396 DU 30/09/2021 SUR LA PERIODE DE MISE A DISPOSITION,2022,INVESTISEMENT 2022 PROSPECTIVE DESTINATION PLANIFICATION,PREF042,2022-01-28,123,92,110,0,0,https://www.saint-etienne-metropole.fr/la-metropole/vie-democratique/deliberations
67,Saint-etienne metropole (SEM),24420077000117,2022.0004,2022-01-27,,,PLAN DE RELANCE METROPOLITAIN 2021-2023 - ATTRIBUTION D’UN FONDS DE CONCOURS A LA COMMUNE D’UNIEUX - RENOVATION ENERGETIQUE DU GROUPE SCOLAIRE CLAUDIUS BUARD,2022,ADMINISTRATION GÉNÉRALE DU BUDGET PRINCIPAL,PREF042,2022-02-08,123,93,110,0,0,https://www.saint-etienne-metropole.fr/la-metropole/vie-democratique/deliberations
68,Saint-etienne metropole (SEM),24420077000117,2022.00059,2022-01-27,,,VOEU RELATIF A LA PARTICIPATION DE L’ETAT A LA PRISE EN CHARGE DU COUT DES AESH SUR LE TEMPS PERISCOLAIRE ET DEMANDANT L’INSTAURATION D’UN VERITABLE STATUT POUR CES ACCOMPAGNANTS,2022,,PREF042,2022-02-08,123,92,110,0,0,https://www.saint-etienne-metropole.fr/la-metropole/vie-democratique/deliberations
69,Saint-etienne metropole (SEM),24420077000117,2022.00044,2022-01-27,,,LANCEMENT DE L’OPAH COPROPRIETE DEGRADEE CONCORDE-CARAVELLE SUR LE QUARTIER DE LA CHAPELLE A ANDREZIEUX-BOUTHEON : SIGNATURE DE LA CONVENTION,2022,HABITAT,PREF042,2022-02-08,123,92,110,0,0,https://www.saint-etienne-metropole.fr/la-metropole/vie-democratique/deliberations
70,Saint-etienne metropole (SEM),24420077000117,2022.00036,2022-01-27,,,BUDGET ANNEXE EAU - REDEVANCE EAU POTABLE - RECTIFICATION D’UNE ERREUR MATERIELLE,2022,,PREF042,2022-02-08,123,93,110,0,0,https://www.saint-etienne-metropole.fr/la-metropole/vie-democratique/deliberations
71,Saint-etienne metropole (SEM),24420077000117,2022.00038,2022-01-27,,,SYNDICAT MIXTE D’AMENAGEMENT DES GORGES DE LA LOIRE - MODIFICATION DES STATUTS,2022,,PREF042,2022-02-08,123,92,110,0,0,https://www.saint-etienne-metropole.fr/la-metropole/vie-democratique/deliberations
72,Saint-etienne metropole (SEM),24420077000117,2022.00029,2022-01-27,,,PLAN LOCAL D’URBANISME (PLU) DE VILLARS - MODIFICATION SIMPLIFIEE N°2- MODALITES DE MISE A DISPOSITION DU PUBLIC,2022,INVESTISEMENT 2022 PROSPECTIVE DESTINATION PLANIFICATION,PREF042,2022-01-28,123,92,110,0,0,https://www.saint-etienne-metropole.fr/la-metropole/vie-democratique/deliberations
73,Saint-etienne metropole (SEM),24420077000117,2022.00051,2022-01-27,,,TRAVAUX D’EXTENSION DE RESEAUX TELECOM – « PROPRIETE FORLINI » RUE DES VIGNES - COMMUNE DE FARNAY - ATTRIBUTION D’UN FONDS DE CONCOURS AU SIEL,2022,VOIRIE,PREF042,2022-02-08,123,92,110,0,0,https://www.saint-etienne-metropole.fr/la-metropole/vie-democratique/deliberations
74,Saint-etienne metropole (SEM),24420077000117,2022.00027,2022-01-27,,,PLAN LOCAL D’URBANISME (PLU) DE L’HORME - APPROBATION DE LA MODIFICATION SIMPLIFIEE N°4,2022,INVESTISEMENT 2022 PROSPECTIVE DESTINATION PLANIFICATION,PREF042,2022-01-28,123,92,110,0,0,https://www.saint-etienne-metropole.fr/la-metropole/vie-democratique/deliberations
75,Saint-etienne metropole (SEM),24420077000117,2022.00032,2022-01-27,,,BUDGET 2022 - DEBAT D'ORIENTATION BUDGETAIRE - APPROBATION,2022,,PREF042,2022-02-08,123,95,95,10,3,https://www.saint-etienne-metropole.fr/la-metropole/vie-democratique/deliberations
76,Saint-etienne metropole (SEM),24420077000117,2022.00031,2022-01-27,,,RAPPORT DE DEVELOPPEMENT DURABLE 2021,2022,,PREF042,2022-02-08,123,108,,,,https://www.saint-etienne-metropole.fr/la-metropole/vie-democratique/deliberations
